{
  "format": 1,
  "kind": "shellcanvas-theme",
  "id": "example.canvas-study",
  "version": "1.1.0",
  "name": "Canvas Study",
  "author": "Your name",
  "description": "A starting point for your own light and dark desktop theme.",
  "variants": {
    "dark": {
      "colors": {
        "base": "#19191c",
        "surface": "#242427",
        "raised": "#303034",
        "inset": "#1d1d20",
        "text": "#f2f2f5",
        "muted": "#b0b0ba",
        "accent": "#7ab8ff",
        "onAccent": "#102745",
        "border": "#48484f",
        "hover": "#39393f",
        "selection": "#293f5b",
        "danger": "#f1a7a7",
        "dangerSoft": "#462d33",
        "warning": "#f2c572",
        "warningSoft": "#413527",
        "success": "#91d6a3",
        "shadow": "#08080d",
        "scrim": "#111118",
        "terminal": "#161619",
        "terminalText": "#e5e5ea",
        "sky": "#102655",
        "glow": "#536dd4",
        "far": "#455b96",
        "mid": "#293c72",
        "near": "#172345"
      },
      "windowRadius": 14,
      "windowHeader": 43,
      "dockRadius": 20,
      "blur": 24,
      "toolbarHeight": 44,
      "dockSize": 42,
      "font": "system"
    },
    "light": {
      "colors": {
        "base": "#f0f0f3",
        "surface": "#fafafa",
        "raised": "#f0f0f3",
        "inset": "#e8e8ed",
        "text": "#202024",
        "muted": "#585861",
        "accent": "#005fb8",
        "onAccent": "#ffffff",
        "border": "#c9c9d1",
        "hover": "#e2e2e8",
        "selection": "#d6e7fb",
        "danger": "#a02f3d",
        "dangerSoft": "#f8e6e5",
        "warning": "#805400",
        "warningSoft": "#fff1d6",
        "success": "#26733b",
        "shadow": "#252535",
        "scrim": "#242432",
        "terminal": "#ffffff",
        "terminalText": "#242429",
        "sky": "#dde8ff",
        "glow": "#f4edff",
        "far": "#a6b7e2",
        "mid": "#748dc3",
        "near": "#3b558c"
      },
      "windowRadius": 14,
      "windowHeader": 43,
      "dockRadius": 20,
      "blur": 24,
      "toolbarHeight": 44,
      "dockSize": 42,
      "font": "system"
    }
  }
}
